{
  "title": "Memorial Conversation - Creating Ramon's Digital Legacy",
  "description": "AI-guided conversation with Ramon Serrano's widow to create a collaborative digital memorial celebrating his life as a professor, father, and husband",
  "author": "Memorial Mosaic Team",
  "version": "1.0.0",
  "tags": ["family", "professor", "collaborative", "legacy"],
  "conversation": [
    {
      "type": "ai",
      "message": "Hello, and first, let me express my deepest condolences for your loss. I'm here to help you create something meaningful to honor Ramon's memory - a digital experience that captures who he was as a husband, father, and professor. Before we begin, how are you holding up?",
      "delay": 2000,
      "activeAgents": {
        "collaborator": {
          "extraction": ["Initial context gathering", "Relationship identification"],
          "analysis": ["Emotional state assessment"]
        }
      }
    },
    {
      "type": "user",
      "message": "Thank you. It's been difficult, but I want to do something special for Ramon. The kids and I have been going through his things, and there's so much of his life we want to preserve and share."
    },
    {
      "type": "ai",
      "message": "I can imagine how overwhelming yet precious that process must be. Let's start by understanding what you envision for Ramon's digital memorial. What aspects of his life feel most important to capture - his role as a father, his academic career, or perhaps the way he touched so many lives?",
      "delay": 1500,
      "activeAgents": {
        "collaborator": {
          "extraction": ["Life role identification", "Priority mapping"],
          "analysis": ["Theme identification", "Importance weighting"],
          "outputs": ["Potential memorial focus areas"]
        }
      }
    },
    {
      "type": "user",
      "message": "All of it, really. He was such a devoted father to our two children, and his students meant the world to him. But most of all, I want people to understand what kind of man he was at home - his humor, his patience, the way he made everyone feel heard."
    },
    {
      "type": "ai",
      "message": "What a beautiful foundation - capturing Ramon as a whole person, not just his professional achievements. To create something truly meaningful, I'd like to understand what kinds of materials and memories you have access to. Do you have things like family videos, his writings, voice recordings, emails, or perhaps access to his social media accounts?",
      "delay": 1800,
      "activeAgents": {
        "collaborator": {
          "extraction": ["Available data sources inventory", "Content type classification"],
          "analysis": ["Data quality assessment", "Content richness evaluation"],
          "outputs": ["Feasible experience types based on available data"]
        },
        "archiver": {
          "preparing": ["Data source catalog structure", "Access requirement checklist"]
        }
      }
    },
    {
      "type": "user",
      "message": "We have quite a bit actually. There are videos from family vacations and birthdays, lots of photos on his phone and computer, his Facebook account, some recorded lectures from his classes, and boxes full of handwritten notes and letters. Oh, and I found a box with probably a thousand printed photos from before we went digital."
    },
    {
      "type": "ai",
      "message": "You have wonderful raw materials to work with. The videos, recorded lectures, and digital content are perfect for creating an interactive memorial. However, I should mention - while those thousand printed photos hold incredible sentimental value, trying to digitize and incorporate all of them might actually dilute the impact of the memorial. Instead, we could select maybe 20-30 that truly capture pivotal moments or showcase his personality. Quality over quantity will create a more powerful emotional experience. Does that make sense?",
      "delay": 2000,
      "activeAgents": {
        "collaborator": {
          "extraction": ["Data volume assessment", "Content categorization"],
          "analysis": ["Quality vs quantity evaluation", "Impact optimization"],
          "outputs": ["Curation strategy recommendation"]
        },
        "curator": {
          "advising": ["Content selection criteria", "Emotional impact optimization"]
        }
      }
    },
    {
      "type": "user",
      "message": "Yes, that makes perfect sense. I was actually feeling overwhelmed thinking about scanning all of those. So what would you recommend we focus on?"
    },
    {
      "type": "ai",
      "message": "Based on what you've shared, I'd recommend creating a multi-faceted digital experience that includes: First, a 'Talk with Ramon' feature using his recorded lectures and videos to recreate his voice and manner of speaking - imagine family members being able to ask him questions and hear responses in his own voice. Second, an interactive timeline showing his journey as a professor, father, and husband with carefully selected photos and stories. Third, a collection of 'Ramon-isms' - those phrases, jokes, or pieces of advice he was known for. And finally, a collaborative memory wall where family, friends, colleagues, and students can add their own stories. How does this sound to you?",
      "delay": 2200,
      "activeAgents": {
        "collaborator": {
          "outputs": ["Talk with Ramon AI", "Interactive Timeline", "Ramon-isms Collection", "Collaborative Memory Wall"]
        },
        "curator": {
          "building": ["Voice modeling architecture", "Narrative structure design", "Visual composition planning"]
        },
        "archiver": {
          "planning": ["Data requirements for each experience", "Storage architecture"]
        }
      }
    },
    {
      "type": "user",
      "message": "Oh my goodness, the 'Talk with Ramon' idea just gave me chills. He had such a distinctive way of explaining things. And yes to all of it - especially the collaborative part. I know his sister Maria would want to contribute, and several of his colleagues have reached out wanting to help."
    },
    {
      "type": "ai",
      "message": "I'm so glad that resonates with you. The collaborative aspect will make this truly special. Let me ask - besides Maria, who else do you think would want to contribute? I'm thinking about his colleagues, perhaps some longtime students, close friends? We can set up different contribution tracks so each person can share what they knew best about Ramon.",
      "delay": 1800,
      "activeAgents": {
        "collaborator": {
          "extraction": ["Contributor network mapping", "Relationship classification"],
          "analysis": ["Contribution potential assessment", "Perspective diversity evaluation"]
        },
        "archiver": {
          "structuring": ["Multi-contributor data organization system"]
        }
      }
    },
    {
      "type": "user",
      "message": "Definitely his department chair, Dr. Chen - they worked together for 15 years. His best friend Carlos from graduate school. Our children, of course - they're 19 and 22 now. And there's a former student, Jennifer, who became like family to us. She just became a professor herself and credits Ramon with inspiring her."
    },
    {
      "type": "ai",
      "message": "What a beautiful circle of people who loved Ramon. Each of them likely has unique perspectives: Dr. Chen could share about his professional impact and mentorship style, Carlos might have stories from their younger days, your children have irreplaceable memories of him as a father, and Jennifer can speak to his lasting influence. Speaking of your children, what ages were they in some of those family videos? I ask because incorporating their younger voices alongside current reflections could create a powerful emotional arc.",
      "delay": 2000,
      "activeAgents": {
        "collaborator": {
          "extraction": ["Temporal data points", "Voice sample identification"],
          "analysis": ["Emotional arc construction", "Multi-temporal narrative potential"]
        },
        "curator": {
          "building": ["Temporal narrative design", "Voice evolution showcase"]
        }
      }
    },
    {
      "type": "user",
      "message": "We have videos going back to when they were toddlers. There's one where our daughter, maybe 5 years old, is 'teaching' Ramon how to make cookies, and he's playing along so seriously. And another where our son interviews him for a school project about 'My Hero.'"
    },
    {
      "type": "ai",
      "message": "Those sound absolutely precious and perfect for the memorial. The contrast between those innocent childhood moments and their adult reflections will be incredibly moving. Now, to create the 'Talk with Ramon' feature effectively, I'll need to understand his communication style. From his lectures and your memories, how would you describe the way he explained things or gave advice?",
      "delay": 1800,
      "activeAgents": {
        "collaborator": {
          "extraction": ["Communication pattern identification", "Speech characteristics"],
          "analysis": ["Personality trait extraction", "Voice modeling parameters"]
        },
        "curator": {
          "building": ["Voice synthesis parameters", "Conversational AI personality model"]
        }
      }
    },
    {
      "type": "user",
      "message": "He had this gift for making complex things simple. He'd always start with 'Well, let's think about it this way...' and then use everyday analogies. He was patient, never made anyone feel stupid for asking questions. And he had this gentle humor - he'd often end serious conversations with a dad joke to lighten the mood."
    },
    {
      "type": "ai",